{
  "$schema": "http://json-schema.org/schema",
  "definitions": {
    "downloadList": {
      "type": "array",
      "minItems": 1,
      "items": {
        "type": "object",
        "additionalProperties": false,
        "required": [
          "host",
          "href"
        ],
        "properties": {
          "host": {
            "description": "Name of website where download is hosted.",
            "type": "string"
          },
          "href": {
            "description": "HREF to use in download link.",
            "type": "string"
          }
        }
      }
    },
    "expansionPacks": {
      "type": "string",
      "enum": [
        "Get to Work",
        "Get Together",
        "City Living",
        "Cats & Dogs",
        "Seasons",
        "Get Famous",
        "Island Living",
        "Discover University",
        "Eco Lifestyle",
        "Snowy Escape",
        "Cottage Living",
        "High School Years",
        "Growing Together",
        "For Rent",
        "Life & Death",
        "Businesses & Hobbies",
        "Enchanted by Nature",
        "Adventure Awaits",
        "Royalty & Legacy"
      ]
    },
    "gamePacks": {
      "type": "string",
      "enum": [
        "Outdoor Retreat",
        "Spa Day",
        "Dine Out",
        "Vampires",
        "Parenthood",
        "Jungle Adventure",
        "Strangerville",
        "Realm of Magic",
        "Journey to Batuu",
        "Dream Home Decorator",
        "My Wedding Stories",
        "Werewolves"
      ]
    },
    "stuffPacks": {
      "type": "string",
      "enum": [
        "Luxury Party Stuff",
        "Perfect Patio Stuff",
        "Cool Kitchen Stuff",
        "Spooky Stuff",
        "Movie Hangout Stuff",
        "Romantic Garden Stuff",
        "Kids Room Stuff",
        "Backyard Stuff",
        "Vintage Glamour Stuff",
        "Bowling Night Stuff",
        "Fitness Stuff",
        "Toddler Stuff",
        "Laundry Day Stuff",
        "My First Pet Stuff",
        "Moschino Stuff",
        "Tiny Living Stuff",
        "Nifty Knitting Stuff",
        "Paranormal Stuff"
      ]
    },
    "kitPacks": {
      "type": "string",
      "enum": [
        "Throwback Fit Kit",
        "Country Kitchen Kit",
        "Bust the Dust Kit",
        "Courtyard Oasis Kit",
        "Fashion Street Kit",
        "Industrial Loft Stuff",
        "Incheon Arrivals Kit",
        "Modern Menswear Kit",
        "Blooming Rooms Kit",
        "Carnaval Streetwear Kit",
        "Decor to the Max Kit",
        "Moonlight Chic Kit",
        "Little Campers Kit",
        "First Fits Kit",
        "Desert Luxe Kit",
        "Pastel Pop Kit",
        "Everyday Clutter Kit",
        "Simtimates Collection Kit",
        "Bathroom Clutter Kit",
        "Greenhouse Haven Kit",
        "Basement Treasures Kit"
      ]
    },
    "packs": {
      "type": "object",
      "properties": {
        "eps": {
          "type": "array",
          "items": {
            "$ref": "#/definitions/expansionPacks"
          }
        },
        "gps": {
          "type": "array",
          "items": {
            "$ref": "#/definitions/gamePacks"
          }
        },
        "sps": {
          "type": "array",
          "items": {
            "$ref": "#/definitions/stuffPacks"
          }
        },
        "kits": {
          "type": "array",
          "items": {
            "$ref": "#/definitions/kitPacks"
          }
        }
      }
    }
  },
  "type": "object",
  "required": [
    "description",
    "name",
    "pages",
    "stage",
    "status",
    "tagline"
  ],
  "properties": {
    "skipIndex": {
      "description": "If true, then don't list this mod in the index.",
      "type": "boolean"
    },
    "description": {
      "description": "Brief description of this mod.",
      "type": "string"
    },
    "documentation": {
      "description": "List of places to download the documentation.",
      "$ref": "#/definitions/downloadList"
    },
    "downloads": {
      "description": "List of places to download the mod.",
      "$ref": "#/definitions/downloadList"
    },
    "downloadWarning": {
      "description": "HTML content to display while downloading the mod.",
      "type": "string"
    },
    "earlyAccess": {
      "description": "What kind of early access this mod is in, if any.",
      "type": "string",
      "enum": [
        "alpha",
        "beta",
        "none"
      ]
    },
    "featured": {
      "description": "Whether or not this mod should be displayed more prominently.",
      "type": "boolean"
    },
    "hasNoCustomStrings": {
      "description": "Whether or not this mod has no custom strings (intentionally negated so default can be false).",
      "type": "boolean"
    },
    "hideTranslations": {
      "description": "Whether or not to hide the translations section.",
      "type": "boolean"
    },
    "lastUpdated": {
      "description": "The date of the last update to this mod.",
      "type": "string"
    },
    "name": {
      "description": "Display name of this mod.",
      "type": "string"
    },
    "notTranslatable": {
      "description": "Whether or not this mod cannot be translated (intentionally negated so default can be false).",
      "type": "boolean"
    },
    "pages": {
      "description": "List of pages to display for this mod.",
      "type": "array",
      "minItems": 1,
      "items": {
        "type": "object",
        "additionalProperties": false,
        "required": [
          "title",
          "html"
        ],
        "properties": {
          "title": {
            "description": "Label to display on the tab for this page.",
            "type": "string"
          },
          "html": {
            "description": "Name of HTML file to use for this page's content.",
            "type": "string"
          }
        }
      }
    },
    "publicRelease": {
      "description": "The date this mod goes public.",
      "type": "string"
    },
    "recommendedPacks": {
      "description": "Packs that enhance this mod's gameplay.",
      "$ref": "#/definitions/packs"
    },
    "requiredPacks": {
      "description": "Packs that are required for this mod to work. If empty, it is BG compatible.",
      "$ref": "#/definitions/packs"
    },
    "seoTags": {
      "description": "Tags to use for SEO with this mod.",
      "type": "array",
      "items": {
        "type": "string"
      }
    },
    "stage": {
      "description": "Current development stage of this mod.",
      "type": "string",
      "enum": [
        "alpha",
        "beta",
        "public",
        "wip"
      ]
    },
    "status": {
      "description": "The current status of this mod.",
      "type": "string",
      "enum": [
        "broken",
        "unreleased",
        "untested",
        "working"
      ]
    },
    "tagline": {
      "description": "Very brief text to display under mod name.",
      "type": "string"
    },
    "translations": {
      "description": "List of available translations.",
      "type": "array",
      "minItems": 1,
      "items": {
        "type": "object",
        "additionalProperties": false,
        "required": [
          "code",
          "translators"
        ],
        "properties": {
          "code": {
            "description": "The code for this locale.",
            "type": "string",
            "enum": [
              "ENG_US",
              "CHS_CN",
              "CHT_CN",
              "CZE_CZ",
              "DAN_DK",
              "DUT_NL",
              "FIN_FI",
              "FRE_FR",
              "GER_DE",
              "ITA_IT",
              "JPN_JP",
              "KOR_KR",
              "NOR_NO",
              "POL_PL",
              "POR_BR",
              "RUS_RU",
              "SPA_EA",
              "SWE_SE"
            ]
          },
          "href": {
            "description": "Link to mod, if it's not included in download.",
            "type": "string"
          },
          "translators": {
            "description": "List of people who contributed to this translation.",
            "type": "array",
            "minItems": 1,
            "items": {
              "type": "object",
              "additionalProperties": false,
              "required": [
                "name"
              ],
              "properties": {
                "name": {
                  "description": "Name of translator.",
                  "type": "string"
                },
                "href": {
                  "description": "Optional link to this translator's web page.",
                  "type": "string"
                }
              }
            }
          },
          "outdated": {
            "description": "Whether or not this translation is outdated.",
            "type": "boolean"
          }
        }
      }
    },
    "version": {
      "description": "Current version of the mod.",
      "type": "string"
    },
    "videos": {
      "description": "List of videos showcasing the mod.",
      "type": "array",
      "items": {
        "type": "object",
        "required": [
          "creator",
          "name",
          "platform",
          "href"
        ],
        "properties": {
          "creator": {
            "description": "Who made the video.",
            "type": "string"
          },
          "href": {
            "description": "Link where the video can be found.",
            "type": "string"
          },
          "name": {
            "description": "Name of the video.",
            "type": "string"
          },
          "platform": {
            "description": "Where the video is posted.",
            "type": "string"
          }
        }
      }
    }
  }
}