{"name":"Extra Holidays","tagline":"Adds more default holidays","description":"Tired of manually adding common holidays to the calendar? This mod will make some more of them appear by default.","version":"1.0","lastUpdated":"June 18, 2023","stage":"public","status":"untested","seoTags":["halloween","spookyfest","easter","flower","4th of july","fourth of july","independece","simdependence","day","holiday","calendar","seasons"],"requiredPacks":{"eps":["Seasons"]},"pages":[{"title":"Details","html":"<div class=\"paragraphs\"><h2>Summary</h2><p>This mod adds three new holidays: \"Spookyfest\", \"Flower Day\", and \"Simdependence Day\". They are each in their own package, so only install the one(s) you want.</p></div><div class=\"paragraphs\"><h2 class=\"danger\">Important Notices</h2><p>This mod requires my <a target=\"_blank\" href=\"#/mods/custom-holiday-utility\">Custom Holiday Utility</a> mod. You must install it as well, or none of these holidays will work.</p><p>If you want these holidays to appear in an existing save, you must run the cheat <code>chu.add_missing_holidays</code>.</p></div><hr><div class=\"paragraphs\"><h2>Spookyfest</h2><div class=\"collapse-split-view\"><div><p>Occurs during Fall. Does NOT come with a day off from work and school.</p><h4 class=\"mt-4\">Schedule</h4><ul><li>7 day seasons &rarr; Monday of week 1</li><li>14 day seasons &rarr; Friday of week 1</li><li>28 day seasons &rarr; Friday of week 3</li></ul></div><img class=\"feature\" style=\"width: 256px\" data-src=\"spookyfest\" alt=\"Spookyfest Traditions\"></div></div><hr><div class=\"paragraphs\"><h2>Flower Day</h2><div class=\"collapse-split-view\"><div><p>Occurs during Spring. Comes with a day off from work and school.</p><h4 class=\"mt-4\">Schedule</h4><ul><li>7 day seasons &rarr; Monday of week 1</li><li>14 day seasons &rarr; Monday of week 1</li><li>28 day seasons &rarr; Monday of week 2</li></ul><p class=\"mt-4 footnote\">Though it is based on Easter, Monday was chosen instead of Sunday because (1) Sunday holidays do not work when you start in that season, (2) being on Sunday would put Flower Day on New Year's Day, and (3) this way you can have the day after off of work and school.</p></div><img class=\"feature\" style=\"width: 256px\" data-src=\"flower-day\" alt=\"Flower Day Traditions\"></div></div><hr><div class=\"paragraphs\"><h2>Simdependence Day</h2><div class=\"collapse-split-view\"><div><p>Occurs during Summer. Comes with a day off from work and school.</p><h4 class=\"mt-4\">Schedule</h4><ul><li>7 day seasons &rarr; Wednesday of week 1</li><li>14 day seasons &rarr; Wednesday of week 1</li><li>28 day seasons &rarr; Wednesday of week 2</li></ul></div><img class=\"feature\" style=\"width: 256px\" data-src=\"simdependence-day\" alt=\"Simdependence Day Traditions\"></div></div>"},{"title":"Changelog","html":"<div class=\"paragraphs\"><h2>1.0 (June 18, 2023)</h2><ul><li>Refactor holidays to use <a target=\"_blank\" href=\"#/mods/custom-holiday-utility\">Custom Holiday Utility</a></li><li>Remove ability to rename holidays</li><li>Add Simdependence Day</li></ul></div><div class=\"paragraphs\"><h2>June 14, 2023</h2><ul><li>Unpublish mod with warning</li></ul></div><div class=\"paragraphs\"><h2>1.0 beta 3 (June 12, 2023)</h2><ul><li>Rename mod from \"Halloween Holiday\" to \"Extra Holidays\"</li><li>Rename \"Halloween\" to \"Spookyfest\" by default</li><li>Add \"Wear Costumes\" to Spookyfest traditions</li><li>Add \"Flower Day\" holiday (based on Easter)</li><li>Rename <code>HolidayNameOverride.txt</code> to <code>HolidayNames.cfg</code></li><li>Remove debug cheats since they didn't even work :)</li></ul></div><div class=\"paragraphs\"><h2>1.0 beta 2 (June 8, 2023)</h2><ul><li>Add <code>HolidayNameOverride.txt</code> to customize holiday name</li></ul></div><div class=\"paragraphs\"><h2>1.0 beta 1 (June 7, 2023)</h2><ul><li>Add default Halloween holiday</li><li>Add debug cheat to start Halloween</li></ul></div>"}],"translations":[{"code":"ENG_US","translators":[{"name":"Frankk"}]}],"downloads":[{"host":"Sim File Share","href":"https://simfileshare.net/folder/190842/"},{"host":"Google Drive","href":"https://drive.google.com/drive/folders/1rPBxN6Gr2SxbUMGcDKZ36IeG7svFTuMW?usp=sharing"}],"downloadWarning":"This mod requires my <a class=\"text-gray-800 dark:text-yellow-800\" target=\"_blank\" href=\"#/mods/custom-holiday-utility\">Custom Holiday Utility</a> mod. You must install it as well, or none of these holidays will work. Each holiday is a standalone mod, so just install the ones you want."}