{"name":"Simway (MLM Mod)","tagline":"Be your own girlboss","description":"How would you like to be your own boss and set your own hours? Join one of three MLMs, peddle their products, throw selling parties, and recruit others to make a profit!","stage":"wip","status":"unreleased","hideTranslations":true,"seoTags":["multi","level","marketing","network","sales","consultant","pyramid","scheme","plumbonne","llamaware"],"pages":[{"title":"Details","html":"<p class=\"danger text-sm\">\"Simway\" has been a work-in-progress for <em>years</em>, and has been paused while I focus on other things, such as <a href=\"https://sims4toolkit.com\" target=\"_blank\">Sims 4 Toolkit</a>. I am pleased to announce it it now back in full-swing development, and is my primary focus. There is no estimated release date at this time.</p><div class=\"paragraphs\"><h2>Planned features</h2><ul><li>At least three different MLMs for your sims to be a part of.</li><li>You may be approached by MLM members who want to sell products or recruit you.</li><li>You can earn money by selling products or recruiting other sims.</li><li>You have to pay a startup fee to join an MLM and a portion of your profits to remain in it. Want out? Have fun with that :)</li><li>Host and attend \"selling parties\" for custom MLM products.</li></ul></div><div class=\"simway-logos-wrapper\"><img data-src=\"simway-logo\"> <img data-src=\"plumbonne-logo\"> <img data-src=\"llamaware-logo\"></div><style>.simway-logos-wrapper {\n    width: 100%;\n    display: flex;\n    flex-wrap: wrap;\n    gap: 1rem;\n    justify-content: center;\n  }\n\n  .simway-logos-wrapper img {\n    max-width: 300px;\n    -webkit-filter: drop-shadow(2px 2px 2px var(--color-shadow));\n    filter: drop-shadow(2px 2px 2px var(--color-shadow));\n  }</style>"}]}