{"name":"Online Homework","tagline":"Do homework on computers","description":"Can't find your sim's notebook? Well, now you can do their homework at any computer or laptop. This mod works for children, teens, and university students.","version":"1.1.1","lastUpdated":"March 6, 2024","stage":"public","status":"working","hasNoCustomStrings":true,"seoTags":["kids","school","interaction"],"recommendedPacks":{"eps":["Discover University"]},"pages":[{"title":"Details","html":"<h2>How to use</h2><div class=\"paragraphs\"><p>Click on any computer (including most CC) to do homework.</p><ul><li><span class=\"font-bold\">Children/Teens</span>: Select the \"Do Homework\" interaction.</li><li><span class=\"font-bold\">University Students</span>: Go to the \"University > University Coursework\" menu, and then select the \"Do Homework\" interaction.</li><p class=\"footnote\">University homework requires the Discover University expansion pack.</p></ul></div><h2>Don't have Discover University?</h2><p>No worries. You can still use this mod with the base game - it'll just ignore the university files.</p>"},{"title":"Changelog","html":"<h2>1.1.1 (March 6, 2024)</h2><ul><li>Consolidate packages for easier installation</li><li>Clean up script to avoid conflicts for users with many script mods</li></ul><h2>1.1 (December 21, 2020)</h2><ul><li>Remove custom strings so that all languages are supported.</li><li>Add online homework for children and teens.</li></ul><h2>1.0.4 (November 15, 2020)</h2><ul><li>Add Polish translation (by Osqar).</li></ul><h2>1.0.3 (October 21, 2020)</h2><ul><li>Add Chinese translation (by MuMu).</li></ul><h2>1.0.2 (October 7, 2020)</h2><ul><li>Add French translation (by Kimikosoma).</li></ul><h2>1.0.1 (October 6, 2020)</h2><ul><li>Fix issue where Italian text showed up in the English version.</li></ul><h2>1.0 (October 6, 2020)</h2><ul><li>Add the ability to do university homework at any computer or laptop.</li></ul>"}],"downloads":[{"host":"Sim File Share","href":"http://www.simfileshare.net/download/2089628/"},{"host":"Google Drive","href":"https://drive.google.com/drive/folders/1GKkgjuWfSklSN7_cN2p0JJsbkF39eKhF?usp=sharing"}]}