{
  "$schema": "../../../schemas/mod.schema.json",
  "name": "Pack Tests",
  "tagline": "Utility for modders",
  "description": "If you ever need to test whether your users have a particular pack installed or not, this script will allow you to do so directly in tuning - no scripting abilities required!",
  "version": "1.0.1",
  "lastUpdated": "July 20, 2021",
  "stage": "public",
  "status": "untested",
  "hideTranslations": true,
  "pages": [
    {
      "title": "For Users",
      "html": "users.html"
    },
    {
      "title": "For Modders",
      "html": "modders.html"
    },
    {
      "title": "Changelog",
      "html": "changelog.html"
    }
  ],
  "documentation": [
    {
      "host": "Sim File Share",
      "href": "http://www.simfileshare.net/download/2251516/"
    }
  ],
  "downloads": [
    {
      "host": "Sim File Share",
      "href": "http://www.simfileshare.net/download/2251515/"
    },
    {
      "host": "Google Drive",
      "href": "https://drive.google.com/drive/folders/19Xw1Yt1FEvT2AzZmnq7dYwe6ImgDZKiv?usp=sharing"
    }
  ]
}