{
  "$schema": "../../../schemas/mod.schema.json",
  "name": "Custom Holiday Fix",
  "tagline": "Makes custom holidays behave",
  "description": "Enable custom holidays in existing saves, and get rid of that pesky exception notification caused by uninstalling them.",
  "version": "1.0",
  "lastUpdated": "June 15, 2023",
  "stage": "wip",
  "status": "unreleased",
  "hideTranslations": true,
  "pages": [
    {
      "title": "For Users",
      "html": "users.html"
    },
    {
      "title": "For Modders",
      "html": "modders.html"
    },
    {
      "title": "Changelog",
      "html": "changelog.html"
    }
  ],
  "requiredPacks": {
    "eps": [
      "Seasons"
    ]
  }
}