{"name":"Followers for Fame","tagline":"Sync followers with fame level","description":"Can you really call yourself a 'Global Superstar' when you only have 12 followers on Simstagram? This mod automatically gives your sim followers whenever they gain fame.","version":"1.1.3","lastUpdated":"May 25, 2022","stage":"public","status":"working","seoTags":["famous","celebrity","auto"],"requiredPacks":{"eps":["Get Famous"]},"pages":[{"title":"Details","html":"<h2>Summary</h2><div class=\"paragraphs\"><p>This mod keeps your sims' follower counts in sync with their fame level. It adds followers when they gain fame, and removes followers when they lose fame. It also provides some cheats to add/remove/set followers.</p><p class=\"danger\"><strong class=\"danger\">Be advised</strong>: This mod does not account for Social Bunny from High School Years; it only syncs followers for regular social media.</p></div><hr><h2>Automatic followers</h2><ul><li>Gain followers when you gain fame.</li><p class=\"footnote\">Interactions that add followers: Selling a painting or photo, making an app or game, licensing a song or lyrics, publishing a book, being nominated for an award, accepting an award, completing a work day as an actor, ranking up as a celebrity, and getting positive PR through the PR agency.</p><li>Lose followers when you lose fame.</li><p class=\"footnote\">Interactions that remove followers: Ranking down as a celebrity and getting bad PR through the PR agency.</p></ul><br><p>Exact amounts for gains/losses are random, but are influenced by the sim's interaction, current fame rank, and current follower count.</p><p class=\"footnote\">Example: A non-famous sim with 10 followers will gain very few for a painting, but a famous sim with 10 million followers will gain hundreds of thousands for a movie.</p><h2>Initial followers for famous sims</h2><p>When you first load a save with this mod installed, all of your famous sims will have their follower counts checked. If they do not have any followers, then they will be given a random amount that corresponds with their fame level.</p><p class=\"footnote\">1 star = ~1k, 2 stars = ~10k, 3 stars = ~100k, 4 stars = ~1M, 5 stars = ~10M</p><h2>Customization & cheats</h2><p>For all of the following, you will need to enable testing cheats with the <code>testingcheats on</code> command.</p><br><h4>Disabling automatic followers for a sim</h4><p>All sims have auto followers on by default, but you can turn it off for specific sims by shift-clicking them and selecting the \"Follower Cheats\" menu option.</p><br><h4>Manually add/remove followers</h4><div class=\"paragraphs\"><p>You can add/remove followers with interactions by shift-clicking a sim and going to the \"Follower Cheats\" menu option.</p><p>Alternatively, you can also use the following console cheats. They each accept 3 arguments, the first being the number of followers, the second being the sim's first name, and the third being their last name.</p><ul><li><code>fkff.add_followers</code> &rarr; Add the specified number of followers to the named sim.</li><p class=\"footnote\">Example: <code>fkff.add_followers 500 bella goth</code> &rarr; Add 500 followers to Bella Goth</p><li><code>fkff.remove_followers</code> &rarr; Remove the specified number of followers from the named sim.</li><p class=\"footnote\">Example: <code>fkff.remove_followers 1000 eliza pancakes</code> &rarr; Remove 1,000 followers from Eliza Pancakes</p><li><code>fkff.set_followers</code> &rarr; Set the named sim's followers to the specified amount.</li><p class=\"footnote\">Example: <code>fkff.set_followers 50000000 judith ward</code> &rarr; Set Judith Ward's follower count to 50 million.</p></ul></div>"},{"title":"Changelog","html":"<h2>1.1.3 (May 25, 2022)</h2><ul><li>Update English strings for pronoun patch.</li></ul><h2>1.1.2 (March 11, 2022)</h2><ul><li>Add Italian and Russian translations.</li></ul><h2>1.1.1 (July 25, 2021)</h2><ul><li>Add Spanish, Chinese, Portuguese, and Norwegian translations.</li></ul><h2>1.1 (November 24, 2020)</h2><ul><li>Make follower gains/losses more realistic (consider current follower count when determining number of followers to add/remove, and lower follower gains for non-famous sims substantially).</li><li>Console cheats to add, remove, or set a specific number of followers for any sim.</li><li>Setting to disable automatic followers for particular sims.</li><li>Automatically give all existing famous sims a starting amount of followers.</li><li>Add Polish translation (by Osqar).</li></ul><h2>1.0.2 (September 15, 2020)</h2><ul><li>Actually fix file structure issue that may cause some errors on Windows installation. Sorry about that!</li></ul><h2>1.0.1 (September 12, 2020)</h2><ul><li>Fix file structure issue that may cause some errors on Windows installation. EDIT: This fix did not work - see v1.0.2.</li></ul><h2>1.0 (July 26, 2020)</h2><ul><li>End 1.0 beta phase.</li></ul><h2>1.0 beta 2 (July 16, 2020)</h2><ul><li>Add string tables for non-English languages.</li></ul><h2>1.0 beta 1 (July 15, 2020)</h2><ul><li>Add automatic follower gains for the following interactions: selling a painting or photo, making an app or game, licensing a song or lyrics, publishing a book, being nominated for and accepting an award, completing a work day as an actor, ranking up as a celebrity, and getting positive PR.</li><li>Add automatic follower losses for the following interactions: ranking down as a celebrity and getting bad PR.</li><li>Add debug cheats to quickly increase or decrease your follower count.</li></ul>"}],"translations":[{"code":"ENG_US","translators":[{"name":"Frankk"}]},{"code":"SPA_EA","translators":[{"name":"Diavlo"}]},{"code":"ITA_IT","href":"https://www.patreon.com/posts/67711723","translators":[{"name":"ISY","href":"https://isytranslations.wixsite.com/isystranslations"}]},{"code":"NOR_NO","translators":[{"name":"Susanne"}]},{"code":"POL_PL","translators":[{"name":"Osqar","href":"https://www.patreon.com/osqar"}]},{"code":"POR_BR","translators":[{"name":"Larissa Sousa"}]},{"code":"RUS_RU","translators":[{"name":"dep4ikk"}]},{"code":"CHT_CN","translators":[{"name":"Ttchubb"}]}],"downloads":[{"host":"Sim File Share","href":"http://www.simfileshare.net/download/1930737/"},{"host":"Google Drive","href":"https://drive.google.com/drive/folders/18eZztaSfaTo5PWO3pC1ITgiL8h8jqD9N?usp=sharing"}]}