{
  "$schema": "../../../schemas/mod.schema.json",
  "name": "Extra Holidays",
  "tagline": "Adds Spookyfest and Flower Day",
  "description": "Tired of manually adding common holidays to the calendar? This mod will make some more of them appear by default.",
  "version": "1.0 beta 3",
  "lastUpdated": "June 12, 2023",
  "stage": "beta",
  "earlyAccess": "beta",
  "publicRelease": "June 14, 2023",
  "status": "working",
  "seoTags": [
    "halloween",
    "spookyfest",
    "easter",
    "flower",
    "holiday",
    "calendar",
    "seasons"
  ],
  "requiredPacks": {
    "eps": [
      "Seasons"
    ]
  },
  "pages": [
    {
      "title": "Details",
      "html": "details.html"
    },
    {
      "title": "Changelog",
      "html": "changelog.html"
    }
  ],
  "translations": [
    {
      "code": "ENG_US",
      "translators": [
        {
          "name": "Frankk"
        }
      ]
    }
  ],
  "downloads": [
    {
      "host": "Patreon",
      "href": "https://www.patreon.com/posts/84235940"
    }
  ],
  "downloadWarning": "You must install the script, but all packages are optional (only install the holidays that you want). To rename a holiday, you can edit the 'HolidayNames.cfg' file with a plain text editor, like Notepad or TextEdit."
}