{
  "$schema": "../../../schemas/mod.schema.json",
  "name": "Custom Holiday Utility",
  "tagline": "Makes modded holidays behave",
  "description": "Enable modded holidays in existing saves, and get rid of that pesky exception notification caused by uninstalling them.",
  "version": "1.1",
  "lastUpdated": "July 4, 2025",
  "stage": "public",
  "status": "untested",
  "hideTranslations": true,
  "pages": [
    {
      "title": "For Users",
      "html": "users.html"
    },
    {
      "title": "For Modders",
      "html": "modders.html"
    },
    {
      "title": "Changelog",
      "html": "changelog.html"
    }
  ],
  "requiredPacks": {
    "eps": [
      "Seasons"
    ]
  },
  "documentation": [
    {
      "host": "Google Drive",
      "href": "https://drive.google.com/drive/folders/1xZTTfFxA18UMaW-MAu2z45eXo7pvQVrS?usp=sharing"
    }
  ],
  "downloads": [
    {
      "host": "Sim File Share",
      "href": "https://simfileshare.net/folder/191078/"
    },
    {
      "host": "Google Drive",
      "href": "https://drive.google.com/drive/folders/1yY0cSKun1qGyzekXatcngoHhlnTt1Z2M?usp=sharing"
    }
  ]
}