{"name":"Festive Milestones","tagline":"Milestones for events and holidays","description":"Your sims should remember their special days. This mod adds milestones for events, festivals, and holidays from various packs.","version":"1.1","lastUpdated":"July 4, 2025","stage":"public","status":"working","seoTags":["festive","festival","event","holiday","developmental","milestone","memories"],"requiredPacks":{"eps":["Growing Together"]},"recommendedPacks":{"eps":["City Living","Island Living","Seasons","Snowy Escape"]},"pages":[{"title":"Details","html":"<h2>Summary</h2><p>This mod adds milestones for all events, festivals, and holidays in <strong>City Living</strong>, <strong>Island Living</strong>, <strong>Seasons</strong>, and <strong>Snowy Escape</strong>.</p><hr><div class=\"paragraphs\"><h2 class=\"mt-4\">City Living</h2><p>There are 5 milestones for the festivals and events that occur in San Myshuno. To get these, you need to be nearby the area while they are happening.</p><div class=\"my-4 flex justify-between flex-wrap gap-4\"><ul><li>GeekCon</li><li>Humor &amp; Hijinks Festival</li><li>Romance Festival</li><li>Spice Festival</li><li>Flea Market</li></ul><img class=\"feature\" data-src=\"city-living-milestones\" alt=\"City Living Milestones\"></div></div><hr><div class=\"paragraphs\"><h2 class=\"mt-4\">Island Living</h2><p>There are 8 milestones for events and festivals that occur in Sulani. To get these, you need to be nearby the area while they are happening.</p><div class=\"my-4 flex justify-between flex-wrap gap-4\"><ul><li>Family Fun Day</li><li>Flowers &amp; Music Festival</li><li>Town BBQ</li><li>Town Potluck</li><li>Island Celebration</li><li>Beach Bonfire</li><li>Fishing Competition</li><li>Turtle Hatching</li></ul><img class=\"feature\" data-src=\"island-living-milestones\" alt=\"Island Living Milestones\"></div></div><hr><div class=\"paragraphs\"><h2 class=\"mt-4\">Seasons</h2><p>There are 8 milestones for holidays and meeting special sims from Seasons. To get the milestone for a holiday, you must complete enough traditions to get at least a silver medal for it. To get the milestones for meeting special sims, you have to talk to them.</p><div class=\"my-4 flex justify-between flex-wrap gap-4\"><ul><li>Flower Day*</li><li>Harvestfest</li><li>Love Day</li><li>New Year's Eve</li><li>Simdependence Day*</li><li>Spookyfest*</li><li>Winterfest</li><li>Meeting Father Winter</li><li>Meeting Flower Bunny</li></ul><img class=\"feature\" data-src=\"seasons-milestones\" alt=\"Seasons Milestones\"></div><p class=\"footnote\">* There are no official \"Flower Day\", \"Simdependence Day\", or \"Spookyfest\" holidays in Seasons; these come from my <a href=\"#/mods/extra-holidays\" target=\"_blank\">Extra Holidays</a> mod, which must also be installed in order for these milestones to work.</p></div><hr><div class=\"paragraphs\"><h2 class=\"mt-4\">Snowy Escape</h2><p>There are 4 milestones for festivals and meeting special sims in Mt. Komorebi. To get the milestones for festivals, you just need to be in the area while the festival is happening. To get the milestone for meeting Yamachan, you have to... meet Yamachan.</p><div class=\"my-4 flex justify-between flex-wrap gap-4\"><ul><li>Festival of Light</li><li>Festival of Snow</li><li>Festival of Youth</li><li>Meeting Yamachan</li></ul><img class=\"feature\" data-src=\"snowy-escape-milestones\" alt=\"Snowy Escape Milestones\"></div></div><hr><div class=\"paragraphs\"><h2>Cheats</h2><p>To add all milestones associated with a pack to the active sim, run <code>fkfm.add_all &lt;pack_code&gt;</code>, where the pack code is one of <code>ep03</code> (City Living), <code>ep05</code> (Seasons), <code>ep07</code> (Island Living), or <code>ep10</code> (Snowy Escape).</p></div><hr><div class=\"paragraphs\"><h2>Known issues</h2><ul><li>Traveling on Love Day with this mod installed may cause an exception. I do not know why this exception occurs, but it does not cause any damage to your save/play session and can be ignored until fixed.</li></ul></div>"},{"title":"Changelog","html":"<div class=\"paragraphs\"><h2>1.1 (July 4, 2025)</h2><ul><li>Fix compatibility issue with 2025-07-01 patch (HasTunableReference deprecation).</li></ul></div><div class=\"paragraphs\"><h2>1.0 (June 27, 2023)</h2><ul><li>Add Russian and Spanish translations</li><li>End beta phase (public release)</li></ul></div><div class=\"paragraphs\"><h2>1.0 beta 3 (June 25, 2023)</h2><ul><li>Add milestone for Simdependence Day (from my <a target=\"_blank\" href=\"#/mods/extra-holidays\">Extra Holidays</a> mod)</li></ul></div><div class=\"paragraphs\"><h2>1.0 beta 2 (June 19, 2023)</h2><ul><li>Make Island Living milestones trigger for attending festival rather than participating</li><li>Fix bug with <code>fkfm.add_all</code> cheat that can double existing milestones</li></ul></div><div class=\"paragraphs\"><h2>1.0 beta 1 (June 13, 2023)</h2><ul><li>Create City Living milestones:</li><ul><li>GeekCon</li><li>Humor &amp; Hijinks Festival</li><li>Romance Festival</li><li>Spice Festival</li><li>Flea Market</li></ul></ul></div><div class=\"paragraphs\"><h2>1.0 alpha 3 (June 12, 2023)</h2><ul><li>Create Seasons milestones:</li><ul><li>Flower Day</li><li>Harvestfest</li><li>Love Day</li><li>New Year's Eve</li><li>Spookyfest</li><li>Winterfest</li><li>Meeting Father Winter</li><li>Meeting Flower Bunny</li></ul></ul></div><div class=\"paragraphs\"><h2>1.0 alpha 2 (June 10, 2023)</h2><ul><li>Add safeguard to ensure festival is running when milestone is given</li><li>Change all milestones from \"Life\" to \"Firsts\"</li><li>Rename Island Living milestones to be more Maxis-match</li><li>Create Snowy Escape milestones:</li><ul><li>Festival of Light</li><li>Festival of Snow</li><li>Festival of Youth</li><li>Met Yamachan</li></ul></ul></div><div class=\"paragraphs\"><h2>1.0 alpha 1 (June 7, 2023)</h2><ul><li>Create Island Living milestones:</li><ul><li>Beach Bonfire</li><li>Family Fun Day</li><li>Fishing Competition</li><li>Flowers &amp; Music Festival</li><li>Island Celebration</li><li>Town BBQ</li><li>Town Potluck</li><li>Turtle Hatching</li></ul></ul></div>"}],"translations":[{"code":"ENG_US","translators":[{"name":"Frankk"}]},{"code":"RUS_RU","translators":[{"name":"Ciri"}]},{"code":"SPA_EA","outdated":true,"translators":[{"name":"Juliet26"}]},{"code":"FRE_FR","href":"https://modsims4.fr/divers/mods-etapes-de-vie-pour-vos-sims/#frankk","translators":[{"name":"Kimikosoma"}]},{"code":"CHT_CN","href":"https://www.patreon.com/posts/festive-jie-ri-88706919","translators":[{"name":"MeowCats"}]}],"downloads":[{"host":"SimFileShare","href":"https://simfileshare.net/download/3980085/"},{"host":"Google Drive","href":"https://drive.google.com/drive/folders/1tL7rotY72S3tyL44q9zXZSeowD7C9gvm?usp=drive_link"}],"downloadWarning":"You must install the script, but all packages are optional. Only install packages for packs that you own and want in your game. Playing with packages for packs that you do not own can and will cause issues."}