{"name":"No Discovery Quests","tagline":"I know how to play this game","description":"Prevents \"Discovery Quest\" popups from ever bothering you again.","version":"1.0","lastUpdated":"February 14, 2024","stage":"public","status":"untested","hasNoCustomStrings":true,"seoTags":["discovery","quest","silence","phone","notification"],"pages":[{"title":"Details","html":"<div class=\"paragraphs\"><h2>What does this mod do?</h2><p>It silences \"Discovery Quest\" phone calls and notifications. That's it.</p><h2>Isn't this in my game settings?</h2><p>Yes, but it does not prevent popups that have already been scheduled.</p><p class=\"footnote\">Your existing save(s) likely already have quite a few of these.</p><p>This mod has two advantages over the setting:</p><ul><li>It silences Discovery Quests by default, in every save</li><li>It works on Discovery Quests that have already been scheduled</li></ul><h2>Known issues</h2><ul><li>This mod also silences Reaper's Rewards popups, as they are implemented as Discovery Quests.</li></ul></div>"},{"title":"Changelog","html":"<h2>1.0 (February 14, 2024)</h2><ul><li>Initial release.</li></ul>"}],"downloads":[{"host":"Sim File Share","href":"http://www.simfileshare.net/download/4470810/"},{"host":"Google Drive","href":"https://drive.google.com/file/d/1JES8KGjW8nwvQs7oS3afO_SvD1XMR-TA/view?usp=drive_link"}]}