{"name":"Halloween Holiday","tagline":"Adds Halloween to the calendar","description":"This mod page has been moved. See details for link.","version":"N/A","lastUpdated":"N/A","earlyAccess":"beta","stage":"beta","status":"working","seoTags":[],"pages":[{"title":"Details","html":"<p>This mod has been replaced by the <a href=\"#/mods/extra-holidays\">Extra Holidays</a> mod, which includes multiple holidays rather than just Halloween.</p><p class=\"footnote\">This page is just a temporary placeholder while the redirect is being rolled out.</p>"}],"hideTranslations":true}