{
  "$schema": "../../../schemas/mod.schema.json",
  "name": "Show Sim Info",
  "tagline": "View internal sim data",
  "description": "View all of the internal data for particular sims with an interaction. Originally by Itasan on MTS.",
  "version": "3.8.10",
  "lastUpdated": "September 6, 2025",
  "stage": "public",
  "status": "untested",
  "hideTranslations": true,
  "pages": [
    {
      "title": "Details",
      "html": "details.html"
    },
    {
      "title": "Changelog",
      "html": "changelog.html"
    }
  ],
  "downloadWarning": "If you have downloaded this mod from Mod The Sims, delete that version before installing this one. Note that using a cloud service (OneDrive, Google Drive, iCloud, etc.) to back up your Mods folder can cause files to stick around even after you think you've deleted them.",
  "downloads": [
    {
      "host": "Sim File Share",
      "href": "http://simfileshare.net/folder/167469/"
    },
    {
      "host": "Google Drive",
      "href": "https://drive.google.com/drive/folders/1LysKnKrwf_dkunwtNRuBnDa81p0WeGX-?usp=sharing"
    }
  ]
}