{
  "$schema": "../../../schemas/mod.schema.json",
  "name": "Halloween Holiday",
  "tagline": "Adds Halloween to the calendar",
  "description": "Tired of manually adding Halloween to the calendar? This mod will make it appear by default, just like the other holidays.",
  "version": "1.0 beta 2",
  "lastUpdated": "June 8, 2023",
  "stage": "beta",
  "earlyAccess": "beta",
  "publicRelease": "June 14, 2023",
  "status": "working",
  "seoTags": [
    "halloween",
    "holiday",
    "calendar",
    "seasons"
  ],
  "requiredPacks": {
    "eps": [
      "Seasons"
    ]
  },
  "pages": [
    {
      "title": "Details",
      "html": "details.html"
    },
    {
      "title": "Changelog",
      "html": "changelog.html"
    }
  ],
  "translations": [
    {
      "code": "ENG_US",
      "translators": [
        {
          "name": "Frankk"
        }
      ]
    }
  ],
  "downloads": [
    {
      "host": "Patreon",
      "href": "https://www.patreon.com/posts/84235940"
    }
  ],
  "downloadWarning": "To rename the holiday, edit the contents of HolidayNameOverride.txt. If you like the name \"Halloween\", you can delete this file."
}