{
  "$schema": "../../../schemas/mod.schema.json",
  "name": "Bunpocalypse",
  "tagline": "You want bunnies, you get bunnies",
  "description": "Go ahead, try to escape the bunnies. I dare you.",
  "version": "1.0",
  "lastUpdated": "April 1, 2023",
  "stage": "public",
  "status": "untested",
  "hasNoCustomStrings": true,
  "seoTags": [
    "bunny",
    "rabbit",
    "chaos",
    "funny",
    "weird"
  ],
  "pages": [
    {
      "title": "Details",
      "html": "details.html"
    },
    {
      "title": "Changelog",
      "html": "changelog.html"
    }
  ],
  "downloadWarning": "Please look at the date this mod was posted, and don't take it too seriously. Also, you probably shouldn't save your game while using this mod.",
  "downloads": [
    {
      "host": "Google Drive",
      "href": "https://drive.google.com/file/d/1VJnEqq4MYueiI3tBl930x_CW3OHDTKLR/view?usp=share_link"
    }
  ],
  "requiredPacks": {
    "eps": [
      "Cottage Living"
    ]
  },
  "hideTranslations": true
}