{"name":"Custom Holiday Fix","tagline":"Makes custom holidays behave","description":"Enable custom holidays in existing saves, and get rid of that pesky exception notification caused by uninstalling them.","version":"1.0","lastUpdated":"June 15, 2023","stage":"wip","status":"unreleased","hideTranslations":true,"pages":[{"title":"For Users","html":"<div class=\"paragraphs\"><h2>What does this mod do?</h2><ul><li>Makes it easy for other modders to add custom holidays</li><li>Allows custom holidays to appear in existing saves</li><li>Fixes an error that occurs after uninstalling custom holidays</li><p class=\"footnote\"><span class=\"font-bold danger\">Important:</span> For this to work, this mod must be kept in your game even after uninstalling custom holidays. It works by detecting when the custom holiday is no longer installed. You can remove this mod after uninstalling the holiday, launching your game, and saving.</p></ul></div><div class=\"paragraphs\"><h2>Should I install this mod?</h2><p>If you intend on using any custom holiday mods, even ones that do not list this mod as a requirment, then <span class=\"font-bold\">YES</span>.</p><p>This mod works across-the-board, not just on ones that use this mod's method of adding holidays to the calendar - this means that those other custom holidays will appear in existing saves, and be removed properly when uninstalled.</p></div>"},{"title":"For Modders","html":"<h2>What can this mod do for me?</h2><p>This mod makes it easy for you to add custom holidays to the calendar in a safer way, using a snippet - no scripting required. It also ensures that your holiday will appear in existing saves, and that it does not cause exceptions when uninstalled.</p><h2>How can I use this mod?</h2><p>Download the modders' documentation to get started - it will show you how you can write and use your holiday injector snippet.</p><hr><h2 class=\"danger\">Important notice</h2><p>Do not include my script in your own download, and do not re-upload it anywhere. Doing so will inevitably lead to users having the same code in their game multiple times, and it <span class=\"font-bold\">WILL</span> cause issues. Remember, this is not just an injector, but also a fix.</p>"},{"title":"Changelog","html":"<h2>1.0 (June 15, 2023)</h2><ul><li>Add snippet for injecting custom holidays.</li><li>Retroactively add custom holidays to existing saves.</li><li>Remove uninstalled custom holidays from saves they're included in.</li></ul>"}],"requiredPacks":{"eps":["Seasons"]}}