{"name":"Utter Chaos","tagline":"Your sims will hate this","description":"Saying \"hello\" to your neighbor? You just might burst into flames, turn into an alien, or both. This mod adds a chance for random outcomes to every action in the game.","version":"1.0 beta 1","lastUpdated":"January 16, 2022","stage":"public","status":"untested","hasNoCustomStrings":true,"seoTags":["chaos","chaotic","funny","weird","fire","skeleton","chicken"],"pages":[{"title":"Details","html":"<h2>What does this mod do?</h2><ul><li>Whenever a sim does anything, there is a chance for the outcome of their action to be randomized.</li><p class=\"footnote\">1 out of every 400 random outcomes will involve fire, but the other 399 can be anything from a notification to an alien abduction.</p><li>Random outcomes also count as actions, and can trigger even more randomness.</li><p class=\"footnote\">When it rains, it pours. Have fun.</p></ul><br><div class=\"images-md\"><img data-src=\"mermaid\"> <img data-src=\"buffs\"> <img data-src=\"bella\"> <img data-src=\"cake\"></div><h2>Warnings & known issues</h2><ul><li>For some reason, the randomizer <em>loves</em> picking outcomes related to skeletons and chickens. This is not a joke. You'll see what I mean.</li><p class=\"footnote\"><strong>Tip</strong>: To reduce notification spam from the mystical baby chicken, <a href=\"https://jamesturner.yt/disablepacks\" target=\"_blank\">disable the Cottage Living EP</a>.</p><li>Other gameplay mods may perform actions in the background, and cause an unbearable amount of randomized outcomes.</li><p class=\"footnote\"><strong>Tip</strong>: Remove other gameplay mods before playing with Utter Chaos.</p><li>You <em>will</em> see \"exception\" notifications if you use MC Command Center or Better Exceptions, due to the high degree of randomness this mod produces.</li><p class=\"footnote\"><strong>Tip</strong>: This is unavoidable, and may be annoying. Consider removing these mods while using Utter Chaos.</p></ul><br><p class=\"danger\"><strong>WARNING!</strong> Do not use this mod in saves that you care about. Seriously. Your sims can and will have their lives turned upside down in an instant, and can die without warning. Your builds may also be at risk due to the number of fires this mod starts. You've been warned, use this mod at your own risk.</p>"},{"title":"Changelog","html":"<h2>1.0 beta 1 (January 16, 2022)</h2><ul><li>Incite chaos.</li></ul>"}],"downloadWarning":"This mod is just for dumb fun. You should not be using it in saves that you care about, because anything can happen at any moment (including death). Do not report issues to mod creators while you have this mod installed.","downloads":[{"host":"Sim File Share","href":"http://www.simfileshare.net/download/2929952/"},{"host":"Google Drive","href":"https://drive.google.com/file/d/1ufzQziu243gPupzp4LAamW22qSFQXVf5/view?usp=sharing"}],"videos":[{"creator":"CallMeKevin","name":"A sims mod that makes every choice random","href":"https://youtu.be/-8nblI9gGJ0","platform":"YouTube"},{"creator":"CallMeKevin","name":"I trapped an entire Sims Neighborhood in one house","href":"https://youtu.be/MOKe-XeSxII","platform":"YouTube"}]}